,number,value,datetime_start,datetime_complete,duration,params_activation_fn,params_batch_size,params_clip_range,params_ent_coef,params_gae_lambda,params_gamma,params_learning_rate,params_max_grad_norm,params_n_epochs,params_n_steps,params_net_arch,params_target_kl,params_vf_coef,state
75,75,445.5574584,2025-02-13 08:15:13.064259,2025-02-13 08:16:14.831687,0 days 00:01:01.767428,tanh,256,0.16754672697843404,0.0017730607128526577,0.9273329510058098,0.989923056190437,0.00013811527330066654,0.8411880277271517,9,11,tiny,0.049689133359964624,0.3888392014252118,COMPLETE
76,76,-2079.5231923,2025-02-13 08:16:14.834228,2025-02-13 08:17:07.863768,0 days 00:00:53.029540,relu,256,0.24028325657533997,0.0031183928980557715,0.9226513578371139,0.9867241546676274,0.00010132965056704779,0.8931449195926064,9,12,small,0.038801081375359786,0.5736822056441893,COMPLETE
77,77,383.10188150000005,2025-02-13 08:17:07.866005,2025-02-13 08:18:24.952912,0 days 00:01:17.086907,tanh,128,0.18347147032841604,0.002596790124847955,0.9317699165452631,0.9853765373341306,7.20119798237255e-05,0.9776009639442321,12,10,tiny,0.04610485678229837,0.40083049340385696,COMPLETE
78,78,530.8774512,2025-02-13 08:18:24.954692,2025-02-13 08:19:22.174498,0 days 00:00:57.219806,tanh,1024,0.19112534588525873,0.0015560760578071803,0.9161254968590277,0.981203413801602,0.00014787282732865433,1.0663661412270111,9,11,small,0.05243951864016856,0.31253086499414323,COMPLETE
79,79,-9891.073989199998,2025-02-13 08:19:22.176252,2025-02-13 08:20:09.632685,0 days 00:00:47.456433,relu,64,0.19864366523499674,0.024981317788923065,0.9069353834773919,0.9607003066447986,0.00021279220514468288,0.8149224134939492,11,11,tiny,0.07088494502217807,0.33666442267891744,COMPLETE
80,80,319.4418167,2025-02-13 08:20:09.634641,2025-02-13 08:21:09.883033,0 days 00:01:00.248392,tanh,256,0.2069680644426083,0.0022773343400496666,0.9844324042463142,0.9501560852687101,0.00016255735381017462,1.1530590376060397,8,11,tiny,0.06030365740270155,0.3586174266027147,COMPLETE
81,81,563.534823,2025-02-13 08:21:09.884804,2025-02-13 08:22:11.072455,0 days 00:01:01.187651,tanh,256,0.20226117231474935,0.0018244131451472334,0.9376262860548737,0.9822712737975245,8.258511724801654e-05,0.7201718537406991,9,11,tiny,0.1150167739080974,0.4349561598085936,COMPLETE
82,82,581.7321439,2025-02-13 08:22:11.074276,2025-02-13 08:23:11.270422,0 days 00:01:00.196146,tanh,256,0.19694145703132124,0.0012407010620386538,0.9185745979699995,0.9876747907534515,8.823224839626805e-05,0.6543949499066183,9,11,tiny,0.030725789002383954,0.4491186777075584,COMPLETE
83,83,495.0500367000001,2025-02-13 08:23:11.272075,2025-02-13 08:24:12.250813,0 days 00:01:00.978738,tanh,256,0.19524226165102423,0.04902656418832101,0.9248672915962658,0.9875669184297325,0.00010837675500235001,0.9264414070999617,9,11,tiny,0.031024377765078166,0.4500366459473834,COMPLETE
84,84,398.5499917,2025-02-13 08:24:12.252765,2025-02-13 08:25:13.156970,0 days 00:01:00.904205,tanh,256,0.1901620259434066,0.0028281299942273337,0.9213907391021072,0.9926044486093281,9.867732807119604e-05,0.37321514033901615,9,11,tiny,0.04087706957019343,0.3952444657879908,COMPLETE
85,85,403.28958969999996,2025-02-13 08:25:13.158545,2025-02-13 08:26:06.416025,0 days 00:00:53.257480,tanh,1024,0.19793413491653575,0.0014837279455392311,0.9134114322998401,0.9718048349587544,8.764558275480133e-05,0.7527116140397132,10,11,tiny,0.035776540654357494,0.3745026440649173,COMPLETE
86,86,486.3348715,2025-02-13 08:26:06.417929,2025-02-13 08:27:04.052403,0 days 00:00:57.634474,relu,256,0.1502024688224122,0.003393175464248718,0.9589975253893489,0.9562782637846862,6.620747119341608e-05,1.242194276328657,9,11,small,0.10048855034648979,0.4824702540071734,COMPLETE
87,87,434.9829527,2025-02-13 08:27:04.054657,2025-02-13 08:27:59.882187,0 days 00:00:55.827530,tanh,512,0.1858036211262368,0.0019418628205302045,0.9103244658395423,0.9907449289496574,0.0001275703832036375,0.6520046336392237,9,10,tiny,0.02678852525357656,0.4312926594274617,COMPLETE
88,88,494.44393870000005,2025-02-13 08:27:59.883930,2025-02-13 08:29:01.641260,0 days 00:01:01.757330,tanh,256,0.1811857234676039,0.017891501029849956,0.9182302982355123,0.9853634156116775,9.337188489661461e-05,0.5442351384058837,9,11,tiny,0.12178534471519557,0.41318149031738466,COMPLETE
89,89,478.1626228,2025-02-13 08:29:01.642846,2025-02-13 08:29:58.887489,0 days 00:00:57.244643,relu,1024,0.20167903275607993,0.09521618227365712,0.9276505710004553,0.9894246133952151,7.499479265434077e-05,1.3065277030797688,10,10,small,0.13264886267332174,0.5291675202784544,COMPLETE
90,90,236.34213279999994,2025-02-13 08:29:58.889551,2025-02-13 08:31:27.486930,0 days 00:01:28.597379,tanh,64,0.20769621016520845,0.0012161194648081016,0.9024284090958519,0.9945676105074307,0.00011469238484992395,0.9963663508464459,8,11,tiny,0.043438323000073525,0.3843119179736786,COMPLETE
91,91,515.8483335,2025-02-13 08:31:27.488624,2025-02-13 08:32:28.306925,0 days 00:01:00.818301,tanh,256,0.19337056676210737,0.0010212997662521928,0.9210939998276446,0.9835696021402971,8.478130125361702e-05,0.789032698782894,9,11,tiny,0.020404707202648625,0.44258691260530625,COMPLETE
92,92,377.8485736,2025-02-13 08:32:28.309089,2025-02-13 08:33:31.030746,0 days 00:01:02.721657,tanh,256,0.19719952498300647,0.001332311140166859,0.9188762843145117,0.9785328075088414,7.413989591763185e-05,0.6765329906180975,9,11,tiny,0.02414499860766807,0.42730443819896513,COMPLETE
93,93,460.59949889999996,2025-02-13 08:33:31.032902,2025-02-13 08:34:31.170533,0 days 00:01:00.137631,tanh,256,0.16261513997984264,0.002168305029036595,0.9235851913623748,0.985655483655665,6.170331260081401e-05,0.5880927099060869,9,11,tiny,0.03258945073413684,0.40638383375793385,COMPLETE
94,94,577.7800335999999,2025-02-13 08:34:31.172358,2025-02-13 08:35:31.513591,0 days 00:01:00.341233,tanh,256,0.20519147414511152,0.0017261338083117905,0.9154866002157145,0.9876677179152026,8.845067122283276e-05,0.8799527661889271,9,11,tiny,0.02883782715356753,0.31057498679849577,COMPLETE
95,95,227.47264459999997,2025-02-13 08:35:31.515438,2025-02-13 08:36:34.252266,0 days 00:01:02.736828,tanh,256,0.17627157537765964,0.0016701387347117006,0.9057341812151765,0.987856484941925,0.00019122843793483143,0.8818630868333253,9,11,tiny,0.038621360549485256,0.34158782460514525,COMPLETE
96,96,471.22230099999996,2025-02-13 08:36:34.254028,2025-02-13 08:37:36.405972,0 days 00:01:02.151944,tanh,256,0.2033463124660172,0.0025125269148771607,0.914200111595252,0.9745494977419497,8.947035090461233e-05,0.9371975044873815,9,11,tiny,0.030093408215339533,0.31188719661194586,COMPLETE
97,97,274.30812660000004,2025-02-13 08:37:36.407830,2025-02-13 08:38:31.581849,0 days 00:00:55.174019,relu,1024,0.2122150626909853,0.07897204249980076,0.9122910279627008,0.9869995460877794,0.00010267875391358995,1.112992375567655,9,11,small,0.10867608702670342,0.32773830732478093,COMPLETE
98,98,524.8468881,2025-02-13 08:38:31.584121,2025-02-13 08:39:42.806877,0 days 00:01:11.222756,tanh,128,0.21645984275575128,0.003949449644526969,0.9406724383333158,0.9888591843117257,0.00011151132529375971,1.2032218358064408,9,11,tiny,0.048685859502545524,0.30567206411622067,COMPLETE
99,99,455.10133449999995,2025-02-13 08:39:42.808547,2025-02-13 08:40:45.099312,0 days 00:01:02.290765,tanh,256,0.2083632603860628,0.006026938836811187,0.9718622163657401,0.9518138600589643,6.829189044586414e-05,0.8380575193258468,10,11,tiny,0.03452316335556659,0.3199044334233901,COMPLETE
